{
  "id": "power.solar_ground",
  "schemaVersion": 1,
  "name": "Ground-Mount Solar",
  "description": "A solar field on owned land. Cheaper per MW than rooftop and it competes with every other use of the site.",
  "researchId": "technology.power.solar",
  "kind": "generation",
  "capexFactor": 1.05,
  "variableCostFactor": 0.08,
  "priceMode": "fixed",
  "dispatchability01": 0.15,
  "carbonMode": "fixed",
  "carbonFactor": 0.05,
  "landHectaresPerMw": 1,
  "communityDelta": 2,
  "communityDeltaPerRunHour": 0,
  "renewable": true,
  "clean": true,
  "storageDurationHours": 0,
  "roundTripEfficiency01": 0,
  "degradationPerCycle01": 0,
  "fuelPerMwh": 0,
  "baseAnnualFailureRate": 0.03,
  "leadTimeDays": 180,
  "lifeYears": 25
}
