{
  "id": "power.hydrogen_generator",
  "schemaVersion": 1,
  "name": "Hydrogen-Ready Generator",
  "description": "Firm backup whose emissions depend entirely on where the hydrogen came from. Storage and conversion losses are real.",
  "researchId": "technology.power.hydrogen",
  "kind": "generation",
  "capexFactor": 2.3,
  "variableCostFactor": 1.2,
  "priceMode": "fixed",
  "dispatchability01": 0.78,
  "carbonMode": "fuel",
  "carbonFactor": 0.18,
  "landHectaresPerMw": 0.15,
  "communityDelta": 1,
  "communityDeltaPerRunHour": 0,
  "renewable": false,
  "clean": true,
  "storageDurationHours": 0,
  "roundTripEfficiency01": 0,
  "degradationPerCycle01": 0,
  "fuelPerMwh": 60,
  "baseAnnualFailureRate": 0.06,
  "leadTimeDays": 400,
  "lifeYears": 25
}
