{
  "id": "power.wind_contract",
  "schemaVersion": 1,
  "name": "Wind Offtake Contract",
  "description": "A power purchase agreement with a wind farm. Complements solar on the daily curve and settles against a variable output.",
  "researchId": "technology.power.wind",
  "kind": "contract",
  "capexFactor": 0.9,
  "variableCostFactor": 0.2,
  "priceMode": "fixed",
  "dispatchability01": 0.22,
  "carbonMode": "fixed",
  "carbonFactor": 0.04,
  "landHectaresPerMw": 0.75,
  "communityDelta": 2,
  "communityDeltaPerRunHour": 0,
  "renewable": true,
  "clean": true,
  "storageDurationHours": 0,
  "roundTripEfficiency01": 0,
  "degradationPerCycle01": 0,
  "fuelPerMwh": 0,
  "baseAnnualFailureRate": 0.02,
  "leadTimeDays": 270,
  "lifeYears": 20
}
