{
  "id": "power.battery",
  "schemaVersion": 1,
  "name": "Battery Storage",
  "description": "Four-hour lithium storage. Shifts renewable output into the evening peak and degrades a little with every cycle.",
  "researchId": "technology.grid.battery_storage",
  "kind": "storage",
  "capexFactor": 1.15,
  "variableCostFactor": 0.02,
  "priceMode": "fixed",
  "dispatchability01": 0.98,
  "carbonMode": "fixed",
  "carbonFactor": 0,
  "landHectaresPerMw": 0.06,
  "communityDelta": 0,
  "communityDeltaPerRunHour": 0,
  "renewable": false,
  "clean": false,
  "storageDurationHours": 4,
  "roundTripEfficiency01": 0.88,
  "degradationPerCycle01": 0.00004,
  "fuelPerMwh": 0,
  "baseAnnualFailureRate": 0.03,
  "leadTimeDays": 120,
  "lifeYears": 15
}
