{
  "id": "power.gas_ccgt",
  "schemaVersion": 1,
  "name": "Combined-Cycle Gas",
  "description": "On-site dispatchable generation. Solves the evening peak and writes a direct emissions line into every report.",
  "researchId": "technology.power.gas",
  "kind": "generation",
  "capexFactor": 1.35,
  "variableCostFactor": 0.72,
  "priceMode": "fixed",
  "dispatchability01": 0.88,
  "carbonMode": "fixed",
  "carbonFactor": 0.62,
  "landHectaresPerMw": 0.18,
  "communityDelta": -8,
  "communityDeltaPerRunHour": -0.002,
  "renewable": false,
  "clean": false,
  "storageDurationHours": 0,
  "roundTripEfficiency01": 0,
  "degradationPerCycle01": 0,
  "fuelPerMwh": 180,
  "baseAnnualFailureRate": 0.05,
  "leadTimeDays": 540,
  "lifeYears": 30
}
