{
  "id": "power.hydro_contract",
  "schemaVersion": 1,
  "name": "Hydro Contract",
  "description": "Firm-ish low-carbon supply where the geography allows it. Drought years cut the delivered volume.",
  "researchId": "technology.power.hydro",
  "kind": "contract",
  "capexFactor": 1.1,
  "variableCostFactor": 0.28,
  "priceMode": "fixed",
  "dispatchability01": 0.65,
  "carbonMode": "fixed",
  "carbonFactor": 0.03,
  "landHectaresPerMw": 0.35,
  "communityDelta": -2,
  "communityDeltaPerRunHour": 0,
  "renewable": true,
  "clean": true,
  "storageDurationHours": 0,
  "roundTripEfficiency01": 0,
  "degradationPerCycle01": 0,
  "fuelPerMwh": 0,
  "baseAnnualFailureRate": 0.02,
  "leadTimeDays": 270,
  "lifeYears": 30
}
