{
  "id": "power.grid",
  "schemaVersion": 1,
  "name": "Grid Import",
  "description": "Utility supply at the interconnection point. Cheapest to start, and it carries the regional price and carbon curve.",
  "researchId": null,
  "kind": "import",
  "capexFactor": 0.5,
  "variableCostFactor": 1,
  "priceMode": "regional",
  "dispatchability01": 0.85,
  "carbonMode": "regional",
  "carbonFactor": 1,
  "landHectaresPerMw": 0.05,
  "communityDelta": 0,
  "communityDeltaPerRunHour": 0,
  "renewable": false,
  "clean": false,
  "storageDurationHours": 0,
  "roundTripEfficiency01": 0,
  "degradationPerCycle01": 0,
  "fuelPerMwh": 0,
  "baseAnnualFailureRate": 0.02,
  "leadTimeDays": 120,
  "lifeYears": 40
}
