{
  "id": "power.solar_rooftop",
  "schemaVersion": 1,
  "name": "Rooftop Solar",
  "description": "Panels on the halls themselves. No extra land, modest yield, and visible proof of intent to the neighbours.",
  "researchId": "technology.power.solar",
  "kind": "generation",
  "capexFactor": 1.2,
  "variableCostFactor": 0.1,
  "priceMode": "fixed",
  "dispatchability01": 0.15,
  "carbonMode": "fixed",
  "carbonFactor": 0.05,
  "landHectaresPerMw": 0.25,
  "communityDelta": 5,
  "communityDeltaPerRunHour": 0,
  "renewable": true,
  "clean": true,
  "storageDurationHours": 0,
  "roundTripEfficiency01": 0,
  "degradationPerCycle01": 0,
  "fuelPerMwh": 0,
  "baseAnnualFailureRate": 0.03,
  "leadTimeDays": 90,
  "lifeYears": 25
}
