{
  "id": "power.diesel_backup",
  "schemaVersion": 1,
  "name": "Diesel Backup Generators",
  "description": "The emergency backstop. Starts in seconds, and every run hour is noise, fuel cost and local air quality.",
  "researchId": null,
  "kind": "generation",
  "capexFactor": 0.55,
  "variableCostFactor": 1.45,
  "priceMode": "fixed",
  "dispatchability01": 0.95,
  "carbonMode": "fixed",
  "carbonFactor": 1,
  "landHectaresPerMw": 0.08,
  "communityDelta": -12,
  "communityDeltaPerRunHour": -0.02,
  "renewable": false,
  "clean": false,
  "storageDurationHours": 0,
  "roundTripEfficiency01": 0,
  "degradationPerCycle01": 0,
  "fuelPerMwh": 270,
  "baseAnnualFailureRate": 0.08,
  "leadTimeDays": 60,
  "lifeYears": 25
}
