{
  "id": "power.smr",
  "schemaVersion": 1,
  "name": "Small Modular Reactor",
  "description": "A dedicated 100MW-class firm low-carbon asset. Extreme capital, a schedule measured in years, and an approval fight.",
  "researchId": "technology.megaproject.smr",
  "kind": "generation",
  "capexFactor": 6,
  "variableCostFactor": 0.3,
  "priceMode": "fixed",
  "dispatchability01": 0.94,
  "carbonMode": "fixed",
  "carbonFactor": 0.06,
  "landHectaresPerMw": 0.12,
  "communityDelta": -5,
  "communityDeltaPerRunHour": 0,
  "renewable": false,
  "clean": true,
  "storageDurationHours": 0,
  "roundTripEfficiency01": 0,
  "degradationPerCycle01": 0,
  "fuelPerMwh": 0,
  "baseAnnualFailureRate": 0.01,
  "leadTimeDays": 1800,
  "lifeYears": 60
}
