{
  "id": "power.nuclear_contract",
  "schemaVersion": 1,
  "name": "Utility Nuclear Contract",
  "description": "Firm low-carbon electricity at a premium. Public opinion on it swings hard in both directions.",
  "researchId": "technology.power.nuclear_contract",
  "kind": "contract",
  "capexFactor": 1.5,
  "variableCostFactor": 0.38,
  "priceMode": "fixed",
  "dispatchability01": 0.92,
  "carbonMode": "fixed",
  "carbonFactor": 0.07,
  "landHectaresPerMw": 0.1,
  "communityDelta": 0,
  "communityDeltaPerRunHour": 0,
  "renewable": false,
  "clean": true,
  "storageDurationHours": 0,
  "roundTripEfficiency01": 0,
  "degradationPerCycle01": 0,
  "fuelPerMwh": 0,
  "baseAnnualFailureRate": 0.01,
  "leadTimeDays": 365,
  "lifeYears": 40
}
